{
  "schema_version": "1.0",
  "pipeline_version": "6.2.0",
  "default_profile": "FINAL_RELEASE_MOTION",
  "profiles": ["STATIC_READY_FOR_MOTION", "FINAL_RELEASE_STATIC", "FINAL_RELEASE_MOTION"],
  "gates": [
    {"gate_id":"G0_JOB_CONTRACT","handler_id":"job-contract.validate","owner":"manager","dependencies":[],"profiles":["STATIC_READY_FOR_MOTION","FINAL_RELEASE_STATIC","FINAL_RELEASE_MOTION"],"required_capabilities":["python","jsonschema"],"output_schema":"job-contract.schema.json","invalidation_keys":["job_contract"],"skip_policy":{"mode":"NEVER"}},
    {"gate_id":"G1_CAPABILITY_SECURITY","handler_id":"capability.probe","owner":"control-plane","dependencies":["G0_JOB_CONTRACT"],"profiles":["STATIC_READY_FOR_MOTION","FINAL_RELEASE_STATIC","FINAL_RELEASE_MOTION"],"required_capabilities":["powerpoint-com","python","jsonschema"],"output_schema":"capability-report.schema.json","invalidation_keys":["capability","runtime","office","font"],"skip_policy":{"mode":"NEVER"}},
    {"gate_id":"G2_SOURCE_INVENTORY","handler_id":"source.inventory","owner":"intake","dependencies":["G1_CAPABILITY_SECURITY"],"profiles":["STATIC_READY_FOR_MOTION","FINAL_RELEASE_STATIC","FINAL_RELEASE_MOTION"],"required_capabilities":["filesystem"],"output_schema":"source-manifest.schema.json","invalidation_keys":["source"],"skip_policy":{"mode":"NEVER"}},
    {"gate_id":"G3_FORMAT_ADAPTERS","handler_id":"source.adapters","owner":"format-specialist","dependencies":["G2_SOURCE_INVENTORY"],"profiles":["STATIC_READY_FOR_MOTION","FINAL_RELEASE_STATIC","FINAL_RELEASE_MOTION"],"required_capabilities":["format-adapters"],"output_schema":"adapter-result.schema.json","invalidation_keys":["adapter","source"],"skip_policy":{"mode":"NEVER"}},
    {"gate_id":"G4_CANONICAL_EVIDENCE","handler_id":"content.canonicalize","owner":"content-specialist","dependencies":["G3_FORMAT_ADAPTERS"],"profiles":["STATIC_READY_FOR_MOTION","FINAL_RELEASE_STATIC","FINAL_RELEASE_MOTION"],"required_capabilities":["content-extraction"],"output_schema":"canonical-content.schema.json","invalidation_keys":["canonical-content"],"skip_policy":{"mode":"NEVER"}},
    {"gate_id":"G5_RECONCILIATION","handler_id":"content.reconcile","owner":"reconciliation-specialist","dependencies":["G4_CANONICAL_EVIDENCE"],"profiles":["STATIC_READY_FOR_MOTION","FINAL_RELEASE_STATIC","FINAL_RELEASE_MOTION"],"required_capabilities":["reconciliation"],"output_schema":"evidence-graph.schema.json","invalidation_keys":["reconciliation","metrics"],"skip_policy":{"mode":"NEVER"}},
    {"gate_id":"G6_FIDELITY_COVERAGE","handler_id":"content.coverage","owner":"content-specialist","dependencies":["G5_RECONCILIATION"],"profiles":["STATIC_READY_FOR_MOTION","FINAL_RELEASE_STATIC","FINAL_RELEASE_MOTION"],"required_capabilities":["coverage-validator"],"output_schema":"content-coverage-matrix.schema.json","invalidation_keys":["coverage","copy-difference"],"skip_policy":{"mode":"NEVER"}},
    {"gate_id":"G7_NARRATIVE_ARCHITECTURE","handler_id":"narrative.design","owner":"narrative-specialist","dependencies":["G6_FIDELITY_COVERAGE"],"profiles":["STATIC_READY_FOR_MOTION","FINAL_RELEASE_STATIC","FINAL_RELEASE_MOTION"],"required_capabilities":["narrative-review"],"output_schema":"narrative-graph.schema.json","invalidation_keys":["narrative"],"skip_policy":{"mode":"NEVER"}},
    {"gate_id":"G8_SLIDE_BLUEPRINT","handler_id":"slide.blueprint","owner":"blueprint-specialist","dependencies":["G7_NARRATIVE_ARCHITECTURE"],"profiles":["STATIC_READY_FOR_MOTION","FINAL_RELEASE_STATIC","FINAL_RELEASE_MOTION"],"required_capabilities":["blueprint-validator"],"output_schema":"slide-blueprint.schema.json","invalidation_keys":["blueprint"],"skip_policy":{"mode":"NEVER"}},
    {"gate_id":"G9_ART_DIRECTION","handler_id":"visual.art-direction","owner":"design-specialist","dependencies":["G8_SLIDE_BLUEPRINT"],"profiles":["STATIC_READY_FOR_MOTION","FINAL_RELEASE_STATIC","FINAL_RELEASE_MOTION"],"required_capabilities":["visual-system"],"output_schema":"visual-assets.schema.json","invalidation_keys":["art-direction","assets"],"skip_policy":{"mode":"NEVER"}},
    {"gate_id":"G10_REPRESENTATIVE_PROTOTYPE","handler_id":"visual.prototype","owner":"design-specialist","dependencies":["G8_SLIDE_BLUEPRINT","G9_ART_DIRECTION"],"profiles":["STATIC_READY_FOR_MOTION","FINAL_RELEASE_STATIC","FINAL_RELEASE_MOTION"],"required_capabilities":["artifact-tool","powerpoint-com"],"output_schema":"prototype-review.schema.json","invalidation_keys":["prototype","blueprint","art-direction"],"skip_policy":{"mode":"NEVER"}},
    {"gate_id":"G11_STATIC_PRODUCTION","handler_id":"deck.static-author","owner":"authoring-specialist","dependencies":["G10_REPRESENTATIVE_PROTOTYPE"],"profiles":["STATIC_READY_FOR_MOTION","FINAL_RELEASE_STATIC","FINAL_RELEASE_MOTION"],"required_capabilities":["artifact-tool"],"output_schema":"gate-submission.schema.json","invalidation_keys":["static-deck"],"skip_policy":{"mode":"NEVER"}},
    {"gate_id":"G12_STATIC_CERTIFICATION","handler_id":"deck.static-certify","owner":"validator","dependencies":["G11_STATIC_PRODUCTION"],"profiles":["STATIC_READY_FOR_MOTION","FINAL_RELEASE_STATIC","FINAL_RELEASE_MOTION"],"required_capabilities":["powerpoint-com","renderer","ocr"],"output_schema":"gate-submission.schema.json","invalidation_keys":["static-certification"],"skip_policy":{"mode":"NEVER"}},
    {"gate_id":"G13_NATIVE_MOTION","handler_id":"deck.motion-author","owner":"motion-specialist","dependencies":["G12_STATIC_CERTIFICATION"],"profiles":["FINAL_RELEASE_MOTION"],"required_capabilities":["powerpoint-com"],"output_schema":"gate-submission.schema.json","invalidation_keys":["motion-deck"],"skip_policy":{"mode":"PROFILE_EXCLUDED","excluded_profiles":["STATIC_READY_FOR_MOTION","FINAL_RELEASE_STATIC"],"reason":"Motion not part of selected static profile"}},
    {"gate_id":"G14_STATIC_QA","handler_id":"qa.static-independent","owner":"independent-qa","dependencies":["G12_STATIC_CERTIFICATION"],"profiles":["FINAL_RELEASE_STATIC","FINAL_RELEASE_MOTION"],"required_capabilities":["powerpoint-com","renderer"],"output_schema":"quality-assessment.schema.json","invalidation_keys":["static-qa"],"skip_policy":{"mode":"PROFILE_EXCLUDED","excluded_profiles":["STATIC_READY_FOR_MOTION"],"reason":"Intermediate profile does not release static final"},"independent_reviewer_required":true},
    {"gate_id":"G14_MOTION_QA","handler_id":"qa.motion-independent","owner":"independent-qa","dependencies":["G13_NATIVE_MOTION"],"profiles":["FINAL_RELEASE_MOTION"],"required_capabilities":["powerpoint-com","renderer"],"output_schema":"quality-assessment.schema.json","invalidation_keys":["motion-qa"],"skip_policy":{"mode":"PROFILE_EXCLUDED","excluded_profiles":["STATIC_READY_FOR_MOTION","FINAL_RELEASE_STATIC"],"reason":"Motion QA not part of selected static profile"},"independent_reviewer_required":true},
    {"gate_id":"G15_STATIC_RELEASE","handler_id":"release.static-certify","owner":"certifier","dependencies":["G14_STATIC_QA"],"profiles":["FINAL_RELEASE_STATIC"],"required_capabilities":["release-certifier"],"output_schema":"release-certificate.schema.json","invalidation_keys":["release"],"skip_policy":{"mode":"PROFILE_EXCLUDED","excluded_profiles":["STATIC_READY_FOR_MOTION","FINAL_RELEASE_MOTION"],"reason":"Static release terminal only for static profile"},"terminal":true},
    {"gate_id":"G15_MOTION_RELEASE","handler_id":"release.motion-certify","owner":"certifier","dependencies":["G14_STATIC_QA","G14_MOTION_QA"],"profiles":["FINAL_RELEASE_MOTION"],"required_capabilities":["release-certifier"],"output_schema":"release-certificate.schema.json","invalidation_keys":["release"],"skip_policy":{"mode":"PROFILE_EXCLUDED","excluded_profiles":["STATIC_READY_FOR_MOTION","FINAL_RELEASE_STATIC"],"reason":"Motion release terminal only for motion profile"},"terminal":true}
  ]
}
